<?xml version="1.0" encoding="UTF-8"?>
<xsd:schema xmlns:xsd="http://www.w3.org/2000/10/XMLSchema" xmlns:od="urn:schemas-microsoft-com:officedata">
<xsd:element name="dataroot">
<xsd:complexType>
<xsd:choice maxOccurs="unbounded">
<xsd:element ref="tblKlasser"/>
</xsd:choice>
</xsd:complexType>
</xsd:element>
<xsd:element name="tblKlasser">
<xsd:annotation>
<xsd:appinfo>
<od:index index-name="PrimaryKey" index-key="idK " primary="yes" unique="yes" clustered="no"/>
<od:index index-name="Klass" index-key="Klass " primary="no" unique="no" clustered="no"/>
</xsd:appinfo>
</xsd:annotation>
<xsd:complexType>
<xsd:sequence>
<xsd:element name="idK" od:jetType="autonumber" od:sqlSType="int" od:autoUnique="yes" od:nonNullable="yes">
<xsd:simpleType>
<xsd:restriction base="xsd:integer"/>
</xsd:simpleType>
</xsd:element>
<xsd:element name="Aar" minOccurs="0" od:jetType="integer" od:sqlSType="smallint" type="xsd:short"/>
<xsd:element name="Klassnamn" minOccurs="0" od:jetType="text" od:sqlSType="nvarchar">
<xsd:simpleType>
<xsd:restriction base="xsd:string">
<xsd:maxLength value="20"/>
</xsd:restriction>
</xsd:simpleType>
</xsd:element>
<xsd:element name="Klass" minOccurs="0" od:jetType="text" od:sqlSType="nvarchar">
<xsd:simpleType>
<xsd:restriction base="xsd:string">
<xsd:maxLength value="5"/>
</xsd:restriction>
</xsd:simpleType>
</xsd:element>
</xsd:sequence>
</xsd:complexType>
</xsd:element>
</xsd:schema>
